{
  "$schema": "https://json-schema.org/draft/2020-12/schema", "$id": "https://serviceos.example/schemas/events/service-assignment-pending-activation-v2.schema.json",
  "title": "ServiceAssignmentPendingActivationV2", "type": "object", "additionalProperties": false,
  "required": ["eventId", "eventType", "schemaVersion", "tenantId", "correlationId", "causationId", "aggregateType", "aggregateId", "aggregateVersion", "occurredAt", "payload"],
  "properties": {"eventId": {"type": "string", "format": "uuid"}, "eventType": {"const": "service.assignment.pending-activation"}, "schemaVersion": {"const": 2}, "tenantId": {"type": "string"}, "correlationId": {"type": "string"}, "causationId": {"type": "string"}, "aggregateType": {"const": "ServiceAssignment"}, "aggregateId": {"type": "string", "format": "uuid"}, "aggregateVersion": {"const": 1}, "occurredAt": {"type": "string", "format": "date-time"}, "payload": {"$ref": "#/$defs/payload"}},
  "$defs": {"payload": {"type": "object", "additionalProperties": false,
    "required": ["serviceAssignmentId", "sagaId", "workOrderId", "taskId", "responsibilityLevel", "assigneeId", "businessType", "status", "supersedesServiceAssignmentId", "capacityReservationId", "guardId", "preparedTaskAssignmentId", "reasonCode", "initiatedBy", "protocolVersion", "occurredAt"],
    "properties": {"serviceAssignmentId": {"type": "string", "format": "uuid"}, "sagaId": {"type": "string", "format": "uuid"}, "workOrderId": {"type": "string", "format": "uuid"}, "taskId": {"type": "string", "format": "uuid"}, "responsibilityLevel": {"enum": ["NETWORK", "TECHNICIAN"]}, "assigneeId": {"type": "string", "minLength": 1, "maxLength": 128}, "businessType": {"type": "string", "minLength": 1, "maxLength": 100}, "status": {"const": "PENDING_ACTIVATION"}, "supersedesServiceAssignmentId": {"type": "string", "format": "uuid"}, "capacityReservationId": {"type": "string", "format": "uuid"}, "guardId": {"type": "null"}, "preparedTaskAssignmentId": {"type": "null"}, "reasonCode": {"type": "string", "pattern": "^[A-Z][A-Z0-9_]{1,99}$"}, "initiatedBy": {"type": "string", "minLength": 1, "maxLength": 128}, "protocolVersion": {"const": 2}, "occurredAt": {"type": "string", "format": "date-time"}}
  }}
}
