{
  "eventId": "91111111-1111-4111-8111-111111111111", "eventType": "service.assignment.pending-activation", "schemaVersion": 2, "tenantId": "tenant-byd", "correlationId": "corr-m25-pending", "causationId": "idem-m25-pending", "aggregateType": "ServiceAssignment", "aggregateId": "93333333-3333-4333-8333-333333333333", "aggregateVersion": 1, "occurredAt": "2026-07-14T09:01:00Z",
  "payload": {"serviceAssignmentId": "93333333-3333-4333-8333-333333333333", "sagaId": "94444444-4444-4444-8444-444444444444", "workOrderId": "95555555-5555-4555-8555-555555555555", "taskId": "96666666-6666-4666-8666-666666666666", "responsibilityLevel": "TECHNICIAN", "assigneeId": "technician-002", "businessType": "SITE_SURVEY", "status": "PENDING_ACTIVATION", "supersedesServiceAssignmentId": "92222222-2222-4222-8222-222222222222", "capacityReservationId": "97777777-7777-4777-8777-777777777777", "guardId": null, "preparedTaskAssignmentId": null, "reasonCode": "MANUAL_REASSIGNMENT", "initiatedBy": "dispatch-manager", "protocolVersion": 2, "occurredAt": "2026-07-14T09:01:00Z"}
}
